{
  "schema": "bbb.dmx.fixture.profile.v1",
  "key": "generic.mover.16bit",
  "manufacturer": "Generic",
  "model": "16-bit Pan/Tilt Mover",
  "modes": {
    "basic16": {
      "label": "Basic 16-bit",
      "footprint": 8,
      "channels": [
        { "offset": 1, "key": "pan.coarse",  "default": 128 },
        { "offset": 2, "key": "pan.fine",    "default": 0 },
        { "offset": 3, "key": "tilt.coarse", "default": 128 },
        { "offset": 4, "key": "tilt.fine",   "default": 0 },
        { "offset": 5, "key": "dimmer",      "default": 0 },
        { "offset": 6, "key": "shutter",     "default": 0 },
        { "offset": 7, "key": "color",       "default": 0 },
        { "offset": 8, "key": "gobo",        "default": 0 }
      ],
      "parameters": {
        "pan": {
          "type": "u16",
          "channels": ["pan.coarse", "pan.fine"],
          "byte_order": "coarsefine",
          "range_degrees": 540,
          "default": 32768
        },
        "tilt": {
          "type": "u16",
          "channels": ["tilt.coarse", "tilt.fine"],
          "byte_order": "coarsefine",
          "range_degrees": 270,
          "default": 32768
        },
        "dimmer": {
          "type": "u8",
          "channel": "dimmer",
          "default": 0
        },
        "shutter": {
          "type": "u8",
          "channel": "shutter",
          "default": 0
        },
        "color": {
          "type": "u8",
          "channel": "color",
          "default": 0
        },
        "gobo": {
          "type": "u8",
          "channel": "gobo",
          "default": 0
        }
      }
    }
  }
}
